"id","business_name","phone","email","years_in_business","services","neighborhoods","general_info","business_page","category","website","address","rating","keyword","place"
"503055182","Hudson Valley Websites","(845) 800-3789","info@hudsonvalleywebsites.com","5","","","Custom Website Design & Advertising Solutions for Small Business","https://www.yellowpages.com/middletown-ny/mip/hudson-valley-websites-503055182?lid=503055182","Internet Marketing & Advertising, Advertising Agencies, Direct Mail Advertising, Marketing Consultants, Web Site Design & Services","http://www.hudsonvalleywebsites.com","207 Ruth CtMiddletown, NY 10940","","web","Florida,+NY"
"6148641","Foto-Graphix","(845) 469-5668","tracey@fgx.cc","21","Web & Print/Graphic Design Services; eCommerce Solutions; Website Hosting; Web Application Development; Web Programming","","On Time and On Budget; Affordable and Professional Solutions for all your Web & Print Needs; Website Design; eCommerce Solutions; Logo & Brand Design; Business Card Design; Letterhead Design; Website Hosting; Web Application Development; Corporate Identity; ISP Services; Graphic Design","https://www.yellowpages.com/campbell-hall-ny/mip/foto-graphix-6148641?lid=6148641","Internet Marketing & Advertising, Internet Products & Services, Computer Graphics, Computer Software & Services, Advertising Agencies, Graphic Designers, Advertising Specialties, Web Site Design & Services","http://www.fgx.cc","3201 State Route 207Campbell Hall, NY 10916","","web","Florida,+NY"
"470994612","Sparks!","(845) 313-2853","maria.blon@ymail.com","6","Medical Services","","Sparks teaches to create a new vision for their lives so that they will feel more fulfilled. 
Sparks also offers Reiki Therapy so that you can feel more balance, peace and healing in your life!","https://www.yellowpages.com/middletown-ny/mip/sparks-470994612?lid=470994612","Web Site Design & Services","http://www.sparksalive.com","5 Earle StMiddletown, NY 10940","","web","Florida,+NY"
"537811994","Latefi Design","(646) 820-9878","amir@latefidesign.com","","Web design and graphic design","","Located in Orange County, New York, we provide all of Hudson Valley with sleek and modern web design at an affordable price. Visit http://LatefiDesign.com to learn more.","https://www.yellowpages.com/monroe-ny/mip/latefi-design-537811994?lid=537811994","Web Site Design & Services","http://latefidesign.com","1305 East Mombasha RoadMonroe, NY 10950","","web","Florida,+NY"
"505570382","Scribe Doctor","(845) 239-9974","Gary@scribedr.com","6","","","Professional writing services and website design company","https://www.yellowpages.com/middletown-ny/mip/scribe-doctor-505570382?lid=505570382","Copy Writers, Resume Service, Web Site Hosting, Web Site Design & Services","http://www.scribedr.com","280 Route 211 E Ste 7Middletown, NY 10940","","web","Florida,+NY"
"524855661","Tx3 Designs","(845) 797-3636","","2","","","Tx3 Designs offers personalized technical services in web maintenance, web design & development, social media, computer support services and graphic design. Technical know-how to help your business.  Tx3 Designs will help you find the right solution for your business. By providing personalized services to your company's specific need, Tx3 Designs will help provide efficiency, low maintenance solutions and allow you to effectively your target market.   If you just need some technical support to help you navigate the tools for your business, we can help get you started and comfortable with the tools that suit you and your business needs the best.   Personalized services are imperative for the small business owners so they can get the most out of the tools available.  - Are you struggling to navigate a do-it-yourself web building tool?  - Is the management of your website and all the various technical marketing tools taking up too much of your time from your business?  - Is it costing more than you feel it should?  Most businesses spend too much money and time on tools that are NOT working for them due to lack of time and lack of support. The importance of setting up your technical presence is NOT because you have to do so BUT to get the full benefit of a 24x7 marketing tool. If your current website and other social media accounts are NOT giving you this - it is time to take a step back and re-evaluate the costs, the effort and the value! Contact Tx3 Designs to help you.","https://www.yellowpages.com/highland-mills-ny/mip/tx3-designs-524855661?lid=524855661","Speakers, Lectures & Seminars, Training Consultants, Graphic Designers, Computer Technical Assistance & Support Services, Web Site Design & Services","http://www.tx3designs.com","6 Shetland CirHighland Mills, NY 10930","","web","Florida,+NY"
"10233229","Sabor Y Hogar","(845) 258-1250","","13","","","","https://www.yellowpages.com/pine-island-ny/mip/sabor-y-hogar-10233229?lid=10233229","Computer Online Services","http://ulalas.com","21 Treasure LnPine Island, NY 10969","","web","Florida,+NY"
"475567581","Stevomedia","(845) 480-1339","","","","","","https://www.yellowpages.com/monroe-ny/mip/stevomedia-475567581?lid=475567581","Computer Online Services, Computer Software & Services","","35 Brookside RdMonroe, NY 10950","","web","Florida,+NY"
"503083261","Optimum WiFi Hotspot","(866) 251-9162","","","","","Our Cablevision Optimum WiFi hotspot located in Highland Mills, NY is just one of the over 1.5 million Optimum WiFi hotspots you will have unlimited access to as an Optimum Online customer. It’s the Tri-State’s largest WiFi network with speeds faster than 4G and can help you save up to $20 a month on your cellular data bill. And with Optimum Business you can offer your customers WiFi service by becoming a hotspot, if your business qualifies. At Optimum, we have the services that are right for you. Call today, and get TV, phone and internet for your home or business in NY, NJ and CT as early as tomorrow with no contracts to sign. For new residential customers, get Optimum TV with more than 245 channels included and over 600 channels available, plus free HD and On Demand. And with the Optimum App you can watch all of these networks on any device anywhere in your home. Watch tons of networks when you’re away from home with the TV to GO feature in the Optimum App, anywhere there is an internet connection, like any Optimum WiFi hotspot.  Plus, the new Voice Search feature in the Optimum App makes it easier than ever to find your favorite shows- all you have to do is ask.   
 
Also, with the best Multi-Room DVR Plus, you can record up to 15 shows at once, more than FiOS and DirecTV, watch them from any room in the house, and now rewind live TV.  
 
With Optimum Online you will get fast, reliable connections on all your devices simultaneously, anywhere at home with our free Smart Router. With Optimum Voice, get over 20 calling features, and free 411. For new Optimum Business customers, just sign up for Optimum services and get a no-risk, 30-day money back guarantee. You can always count on 24/7, live local support and a same day service guarantee should you experience any issues that cannot be resolved over the phone. At Optimum, we have everything you need to stay connected at home, at your business, or on the go. New residential customers, see optimum.com for offer terms and conditions. For new Optimum Business customers, see optimumbusiness.com for offer terms and conditions.","https://www.yellowpages.com/highland-mills-ny/mip/optimum-wifi-hotspot-503083261?lid=503083261","Internet Service Providers (ISP), Satellite & Cable TV Equipment & Systems, Wi-Fi Hotspots, Cable & Satellite Television, Satellite & Cable TV Equipment & Systems Repair & Service","http://hotspots.optimum.com/ny/highland-mills/654-state-route-32.html","654 State Route 32Highland Mills, NY 10930","","web","Florida,+NY"
"468066498","BOBKET.NET, LLC","(845) 475-8698","bob@bobket.net","8","","","BOBKET.NET, LLC is a consulting practice providing businesses, professional practices and tradesmen with enhanced Internet visibility & facilities via strategic planning, solutions, deployment and/or process management using marketing, social media and internet tools & facilities.","https://www.yellowpages.com/monroe-ny/mip/bobket-net-llc-468066498?lid=468066498","Internet Consultants, Internet Directories, Internet Marketing & Advertising, Business Coaches & Consultants, Web Site Design & Services","http://www.bobket.net","11 Neptune CtMonroe, NY 10950","","web","Florida,+NY"
"531093528","Verizon","(845) 326-9000","","","","","Verizon is one of the largest communication technology companies in the world. 
Every day, we connect millions of people, companies and communities with our powerful technology. We’re using our award-winning networks to make breakthroughs in interactive entertainment, digital media, the Internet of Things and broadband services for customers. Whatever the future looks like, whatever the digital world promises, we will deliver.","https://www.yellowpages.com/middletown-ny/mip/verizon-531093528?lid=531093528","Cellular Telephone Service, Television Service, Cellular Telephone Equipment & Supplies, Wireless Internet Providers","","61 Orange Plaza LnMiddletown, NY 10940","","web","Florida,+NY"
"531088547","Verizon","(845) 695-1342","","17","Phone Equipment","","Verizon is one of the largest communication technology companies in the world. 
Every day, we connect millions of people, companies and communities with our powerful technology. We’re using our award-winning networks to make breakthroughs in interactive entertainment, digital media, the Internet of Things and broadband services for customers. Whatever the future looks like, whatever the digital world promises, we will deliver.","https://www.yellowpages.com/middletown-ny/mip/verizon-531088547?lid=531088547","Cellular Telephone Service, Television Service, Cellular Telephone Equipment & Supplies, Wireless Internet Providers","http://www.verizonwireless.com/stores/new-york/middletown/middletown-galleria-mall-201502/?INTCMP=INT-LOS-NON-EN-MAKEAPPT-06212015-1LOS1-RE","1 N Galleria DrMiddletown, NY 10941","","web","Florida,+NY"
"505192100","Earn Green Online","(845) 636-8203","earngreenonline123@gmail.com","","","","Various methods of making money online.","https://www.yellowpages.com/central-valley-ny/mip/earn-green-online-505192100?lid=505192100","Computer Online Services","http://earngreenonline.com","514 Charlotte CtCentral Valley, NY 10917","","web","Florida,+NY"
"474719550","FIREBALL, LLC","(845) 202-0219","","12","","","Professional IT services! Visit Fireball, LLC to complete your search as we offer you a complete resource as an IT Services Company USA. Our services are offered to both small and intermediate business networks. We associate a team of certified experts who are ready to assist you anytime with tech support, IT consulting , Computer Service, web hosting & design, Cloud hosted applications, Email marketing, Disaster recovery, VOIP, SEO, managed support and other IT services.   We also offer you the best computer support services to go with your request criteria. We use the most effective tools and techniques so as to offer you the desired services that work the best for your business.","https://www.yellowpages.com/highland-mills-ny/mip/fireball-llc-474719550?lid=474719550","Computer Service & Repair-Business, Computers & Computer Equipment-Service & Repair, Computer Hardware & Supplies, Computer Online Services, Computer Software & Services","http://fireballit.net","Smith Clove RdHighland Mills, NY 10930","","web","Florida,+NY"
"511970349","Frontier Communications","(845) 782-9318","","118","","","","https://www.yellowpages.com/monroe-ny/mip/frontier-communications-511970349?lid=511970349","Telephone Communications Services, Communications Services, Telephone Companies-Long Distance Service, Telecommunications Services, Telephone Companies, Telephone Equipment & Systems-Repair & Service, Telecommunications Consultants, Internet Service Providers (ISP), Cable & Satellite Television","http://www.frontier.com","145 N Main StMonroe, NY 10950","","web","Florida,+NY"
"534333385","Spectrum","(866) 874-2389","","","","","The Best Cable TV + Internet + Voice Services. Get the Spectrum Triple Play today. With 125+ channels, the fastest internet speeds and unlimited nationwide calling. Plus NO CONTRACTS. Are you a Small Business? Spectrum Business is the best for your business. Get Business Internet & WiFi, Phone and HD TV today. Call (866) 826-2809","https://www.yellowpages.com/middletown-ny/mip/spectrum-534333385?lid=534333385","Internet Service Providers (ISP), Internet Products & Services, Telephone Communications Services, Computer Network Design & Systems, Telephone Companies, Utility Companies","https://www.spectrum.com","2 Industrial DrMiddletown, NY 10941","","web","Florida,+NY"
"468726468","A J Ross Creative Media","(800) 723-4644","info@ajross.com","28","","","AJRoss Creative Media is a full-service advertising and marketing agency who employs and is associated with some of the most talented creative minds in the industry including renowned graphic designers, web programmers, directors, production engineers, copywriters and composers . While AJRoss works with-in various markets we've specialized for years in Medical, Corporate, Economic Development, Real Estate, Senior Living and Manufacturing. As a result, we can create and implement marketing plans of any size and scope eliminated time consuming, industry specific learning curves.","https://www.yellowpages.com/chester-ny/mip/a-j-ross-creative-media-468726468?lid=468726468","Print Advertising, Public Relations Counselors, Advertising Agencies, Advertising Specialties, Web Site Design & Services","http://www.ajross.com","1149 State Route 17mChester, NY 10918","","web","Florida,+NY"
"503055182","Hudson Valley Websites","(845) 800-3789","info@hudsonvalleywebsites.com","5","","","Custom Website Design & Advertising Solutions for Small Business","https://www.yellowpages.com/middletown-ny/mip/hudson-valley-websites-503055182?lid=503055182","Internet Marketing & Advertising, Advertising Agencies, Direct Mail Advertising, Marketing Consultants, Web Site Design & Services","http://www.hudsonvalleywebsites.com","207 Ruth CtMiddletown, NY 10940","","web","Florida,+NY"
"6148641","Foto-Graphix","(845) 469-5668","tracey@fgx.cc","21","Web & Print/Graphic Design Services; eCommerce Solutions; Website Hosting; Web Application Development; Web Programming","","On Time and On Budget; Affordable and Professional Solutions for all your Web & Print Needs; Website Design; eCommerce Solutions; Logo & Brand Design; Business Card Design; Letterhead Design; Website Hosting; Web Application Development; Corporate Identity; ISP Services; Graphic Design","https://www.yellowpages.com/campbell-hall-ny/mip/foto-graphix-6148641?lid=6148641","Internet Marketing & Advertising, Internet Products & Services, Computer Graphics, Computer Software & Services, Advertising Agencies, Graphic Designers, Advertising Specialties, Web Site Design & Services","http://www.fgx.cc","3201 State Route 207Campbell Hall, NY 10916","","web","Florida,+NY"
"470994612","Sparks!","(845) 313-2853","maria.blon@ymail.com","6","Medical Services","","Sparks teaches to create a new vision for their lives so that they will feel more fulfilled. 
Sparks also offers Reiki Therapy so that you can feel more balance, peace and healing in your life!","https://www.yellowpages.com/middletown-ny/mip/sparks-470994612?lid=470994612","Web Site Design & Services","http://www.sparksalive.com","5 Earle StMiddletown, NY 10940","","web","Florida,+NY"
"537811994","Latefi Design","(646) 820-9878","amir@latefidesign.com","","Web design and graphic design","","Located in Orange County, New York, we provide all of Hudson Valley with sleek and modern web design at an affordable price. Visit http://LatefiDesign.com to learn more.","https://www.yellowpages.com/monroe-ny/mip/latefi-design-537811994?lid=537811994","Web Site Design & Services","http://latefidesign.com","1305 East Mombasha RoadMonroe, NY 10950","","web","Florida,+NY"
"505570382","Scribe Doctor","(845) 239-9974","Gary@scribedr.com","6","","","Professional writing services and website design company","https://www.yellowpages.com/middletown-ny/mip/scribe-doctor-505570382?lid=505570382","Copy Writers, Resume Service, Web Site Hosting, Web Site Design & Services","http://www.scribedr.com","280 Route 211 E Ste 7Middletown, NY 10940","","web","Florida,+NY"
"524855661","Tx3 Designs","(845) 797-3636","","2","","","Tx3 Designs offers personalized technical services in web maintenance, web design & development, social media, computer support services and graphic design. Technical know-how to help your business.  Tx3 Designs will help you find the right solution for your business. By providing personalized services to your company's specific need, Tx3 Designs will help provide efficiency, low maintenance solutions and allow you to effectively your target market.   If you just need some technical support to help you navigate the tools for your business, we can help get you started and comfortable with the tools that suit you and your business needs the best.   Personalized services are imperative for the small business owners so they can get the most out of the tools available.  - Are you struggling to navigate a do-it-yourself web building tool?  - Is the management of your website and all the various technical marketing tools taking up too much of your time from your business?  - Is it costing more than you feel it should?  Most businesses spend too much money and time on tools that are NOT working for them due to lack of time and lack of support. The importance of setting up your technical presence is NOT because you have to do so BUT to get the full benefit of a 24x7 marketing tool. If your current website and other social media accounts are NOT giving you this - it is time to take a step back and re-evaluate the costs, the effort and the value! Contact Tx3 Designs to help you.","https://www.yellowpages.com/highland-mills-ny/mip/tx3-designs-524855661?lid=524855661","Speakers, Lectures & Seminars, Training Consultants, Graphic Designers, Computer Technical Assistance & Support Services, Web Site Design & Services","http://www.tx3designs.com","6 Shetland CirHighland Mills, NY 10930","","web","Florida,+NY"
"10233229","Sabor Y Hogar","(845) 258-1250","","13","","","","https://www.yellowpages.com/pine-island-ny/mip/sabor-y-hogar-10233229?lid=10233229","Computer Online Services","http://ulalas.com","21 Treasure LnPine Island, NY 10969","","web","Florida,+NY"
"475567581","Stevomedia","(845) 480-1339","","","","","","https://www.yellowpages.com/monroe-ny/mip/stevomedia-475567581?lid=475567581","Computer Online Services, Computer Software & Services","","35 Brookside RdMonroe, NY 10950","","web","Florida,+NY"
"481080942","RAVE PCS OF MIDDLETOWN NY L.L.C","(845) 775-4200","Support@METROWIRELESSNY.COM","5","","","","https://www.yellowpages.com/middletown-ny/mip/rave-pcs-of-middletown-ny-l-l-c-481080942?lid=481080942","Wireless Internet Providers, Wireless Communication, Cellular Telephone Equipment & Supplies, Cellular Telephone Service","","34 North StreetMiddletown, NY 10940","","web","Florida,+NY"
"12858375","Logical Choice Media","(845) 477-2288","","12","Central Vacuum RepairCable TV Wiring, Home Automation SystemsAudio-Visual Equipment RepairVacuum Cleaners","","","https://www.yellowpages.com/greenwood-lake-ny/mip/logical-choice-media-12858375?lid=12858375","Computer Online Services, Internet Products & Services","","23 Brook TrlGreenwood Lake, NY 10925","","web","Florida,+NY"
"495957257","Compu solutions","(845) 248-7299","","4","","","","https://www.yellowpages.com/monroe-ny/mip/compu-solutions-495957257?lid=495957257","Computer Online Services, Computer Software & Services, Computers & Computer Equipment-Service & Repair","","73 Forest Rdmonroe, NY 10950","","web","Florida,+NY"
"482175505","Giorgio Armani General Store","(845) 928-9400","","23","","","","https://www.yellowpages.com/central-valley-ny/mip/giorgio-armani-general-store-482175505?lid=482175505","Computer Online Services, Outlet Malls, General Merchandise, Baths, Boutique Items-Wholesale & Manufacturers, Outlet Stores, Clothing Stores","http://giorgioarmani.com","250 Red Apple CtCentral Valley, NY 10917","","web","Florida,+NY"
"497207432","Internet & Television Systems","(845) 469-2400","","","","","","https://www.yellowpages.com/chester-ny/mip/internet-television-systems-497207432?lid=497207432","Internet Service Providers (ISP)","","2210 Whispering HlsChester, NY 10918","","web","Florida,+NY"
"476346102","Law Office of Daren A. Webber","(845) 610-5070","webberlawfirm@gmail.com","","","","","https://www.yellowpages.com/chester-ny/mip/law-office-of-daren-a-webber-476346102?lid=476346102","Attorneys, Immigration Law Attorneys, Bankruptcy Services, Bankruptcy Law Attorneys","http://www.darenawebberesq.com","1108 Kings Hwy Ste 2Chester, NY 10918","","web","Florida,+NY"
"462791515","Warwick Web Works","(845) 986-7793","","20","","","","https://www.yellowpages.com/warwick-ny/mip/warwick-web-works-462791515?lid=462791515","Computer Technical Assistance & Support Services","","PO Box 149Warwick, NY 10990","","web","Florida,+NY"
"17537789","Frontier Communications","(888) 608-8028","","","","","","https://www.yellowpages.com/goshen-ny/mip/frontier-communications-17537789?lid=17537789","Telephone Companies-Long Distance Service, Telecommunications Services, Internet Service Providers (ISP), Telephone Equipment & Systems-Repair & Service, Telephone Equipment & Systems, Cable & Satellite Television","","30 Matthews StGoshen, NY 10924","","web","Florida,+NY"
"503721367","Web Management Company","(845) 343-7966","","","","","","https://www.yellowpages.com/middletown-ny/mip/web-management-company-503721367?lid=503721367","Publishers-Directory & Guide, Directory & Guide Advertising","","626 E Main StMiddletown, NY 10940","","web","Florida,+NY"
"5501905","Eds","(845) 783-4808","","15","","","","https://www.yellowpages.com/monroe-ny/mip/eds-5501905?lid=5501905","Internet Service Providers (ISP)","","40 Forestdale AveMonroe, NY 10950","","web","Florida,+NY"
"533744066","Time Warner Cable","(877) 606-2007","","","","","","https://www.yellowpages.com/monroe-ny/mip/time-warner-cable-533744066?lid=533744066","Cable & Satellite Television, Telephone Companies, Internet Service Providers (ISP)","http://www.timewarnercable.com","785 State Route 17mMonroe, NY 10950","","web","Florida,+NY"
"1090061","Mynetplus.Com","(845) 783-5982","support@mynetplus.com","18","","","","https://www.yellowpages.com/monroe-ny/mip/mynetplus-com-1090061?lid=1090061","Internet Service Providers (ISP), Internet Products & Services","http://cookworldinc.com","501 State Route 208Monroe, NY 10950","","web","Florida,+NY"
"474224057","We Talk Global","(845) 782-6079","","","","","","https://www.yellowpages.com/monroe-ny/mip/we-talk-global-474224057?lid=474224057","Internet Service Providers (ISP), Internet Products & Services","http://21stcenturyrp.com","501 State Route 208Monroe, NY 10950","","web","Florida,+NY"
"10549978","Weber's Store","(845) 343-5220","info@kviuniform.com","43","Work ClothesMen's Work Clothes","","","https://www.yellowpages.com/middletown-ny/mip/webers-store-10549978?lid=10549978","Clothing Stores, Work Clothes, Men's Clothing, Uniforms, Shoe Stores, Uniforms-Accessories","http://www.kviuniform.com","","","web","Florida,+NY"
"465206725","Blue One Technology","(845) 637-7421","","","","","","https://www.yellowpages.com/highland-mills-ny/mip/blue-one-technology-465206725?lid=465206725","Computer Data Recovery, Web Site Hosting, Web Site Design & Services, Computer Service & Repair-Business, Computers & Computer Equipment-Service & Repair","","265 Skyline DrHighland Mills, NY 10930","","web","Florida,+NY"
"463037615","Gracie Enterprises","(845) 351-1096","","18","","","","https://www.yellowpages.com/tuxedo-park-ny/mip/gracie-enterprises-463037615?lid=463037615","Web Site Design & Services","","98 Maple Brook RdTuxedo Park, NY 10987","","web","Florida,+NY"
"483964601","Sites Done Right","(845) 877-7239","admin@sitesdoneright.com","6","","","","https://www.yellowpages.com/tuxedo-park-ny/mip/sites-done-right-483964601?lid=483964601","Web Site Design & Services","http://sitesdoneright.com","2 Store RdTuxedo Park, NY 10987","","web","Florida,+NY"
"481551449","Rich Society INC","(845) 536-7617","tymcflyrs@gmail.com","7","","","","https://www.yellowpages.com/new-windsor-ny/mip/rich-society-inc-481551449?lid=481551449","Record Labels, Graphic Designers, Web Site Design & Services, Photography & Videography","","2072 Independence DrNew Windsor, NY 12553","","web","Florida,+NY"
"29015483","Office Services Of O C","(845) 534-8388","","","","","","https://www.yellowpages.com/cornwall-ny/mip/office-services-of-o-c-29015483?lid=29015483","Web Site Design & Services, Computer System Designers & Consultants","http://www.officeservicesofoc.com","6 Primrose CtCornwall, NY 12518","","web","Florida,+NY"
"470241478","true touch media","(845) 313-5673","","","","","","https://www.yellowpages.com/port-jervis-ny/mip/true-touch-media-470241478?lid=470241478","Video Production Services, Web Site Design & Services","","119 w main stport jervis, NY 12771","","web","Florida,+NY"
